Royal Mail chairman Donald Brydon set to step down,negative
Stakes High for AstraZeneca Heart Drug Facing Tough Competition,negative
UPDATE 1-Dairy Crest loses a third of Morrisons milk contract,negative
Insight hires Aviva's David Hillier for multi-asset team,positive
Primark racks up a happy Christmas after strong sales,positive
UPDATE 1-Pearson expects to grow this year after solid end to 2014,positive
Tesco sells Blinkbox and broadband service to TalkTalk,positive
Unilever profit rises despite sales slump in China,positive
Tesco leads leap in FTSE 100; Marks & Spencer drops,positive
Royal Dutch Shell profit rises; dividend up 4%,positive
Morning Agenda: Shire's Deal for NPS,positive
Carnival Corporation and China Merchants Group Sign Memo of Understanding ...,positive
Teva: FDA Approves Generic Version of AstraZeneca Heartburn Drug,positive
Passengers rise at EasyJet and Aer Lingus,positive
Tesco Abandons Video-Streaming Ambitions in Blinkbox Sale,negative
"FDA approves NPS drug, in move validating Shire takeover deal",positive
Ocwen Reaches Settlement With California Regulator,positive
Morrisons faces festive sales test,negative
Tesco share price dips as Blinkbox Books closes ending supermarket's digital ...,negative
Shire to buy NPS for $5.2 billion to boost rare disease drugs,positive
AstraZeneca's MedImmune Inks Licensing Deal With Omnis Pharmaceuticals,positive
FDA approves Shire's Vyvanse for binge-eating disorder,positive
Companies Thetrainline.com announces arrival of London IPO,positive
Breakingviews: IAG can pay more for Aer Lingus,positive
Tesco share price jumps as Q3 sales top estimates,positive
CRH's concrete bid for Holcim Lafarge assets,positive
Persimmon share price climbs on 23% rise in full-year revenue,positive
Ruling sets lower limit on potential fine for BP,negative
Reed Elsevier share price slides on underwhelming full-year results,negative
UPDATE 1-Meggitt reiterates annual outlook after tough 2014,positive
Slump in Weir leads FTSE down from record high,negative
Bunzl Lifts Dividend Again As Acquisitions Continue To Boost Profits,positive
REFILE-UPDATE 4-Britain's Lloyds to pay first dividend since rescue,positive
GlaxoSmithKline set to complete $20 billion Novartis asset swap next week,positive
Meggitt share price tumbles as profit falls in 'challenging year',negative
Analyst Views: Astrazeneca shares have seen recent volatility; what will 2015 ...,negative
ARM Royalties Accelerate as Smartphone Market Regains Strength,positive
ConAgra Names Former Hillshire Farms CEO Connolly to Top Post,positive
BG Group appoints new CEO one month early,positive
"Glencore Cuts 2015 Budget, Plans To Divest From Lonmin",negative
U.S. Debt Lures Schroders as ECB Depresses Rates,positive
Tullow Oil Suspends Dividend Amid Oil Price Fall,negative
"Oil majors like Royal Dutch Shell, Chevron, BP fail to find reserves to counter ...",negative
Standard Chartered lags on capital worries,negative
Standard Life share price: Insurer buys advice firm Pearson Jones,positive
Tesco closes in on new chairman with Dixons Carphone's John Allan in the frame,positive
MillerCoors Delivers 2.9% Underlying Net Income Growth for 2014,positive
RBS will reportedly appoint Howard Davies as its next chairman,positive
HSBC Hit by Fresh Details of Tax Evasion Claims,negative
Relief for Lewis as Tesco sees sales grow for first time in a year,positive
Morrisons finance chief to fill gap as CEO leaves early,negative
"UPDATE: Persimmon Profit Up Strongly, Outlook Positive",positive
TRLPC - CRH backs Lafarge Holcim asset buy with 6.5 bln euro bridge loan,positive
Tesco shareholders back ITV head for chairman,positive
"Buffett's Berkshire builds Deere stake, dumps Exxon",positive
Aviva Fined $27 Million by U.K. Regulator Over Fee Failings,negative
AstraZeneca's patent on asthma drug invalidated by US court,negative
Rolls-Royce to Ensure Compliance After Petrobras Bribery Report,negative
Whitbread share price climbs on Q4 sales growth,positive
Warren Buffett defends Berkshire Hathaway's conglomerate structure,positive
G4S sees profits rise but UK contract problems remain,positive
Friends Life lifts profits 38% and hikes divi ahead of proposed Aviva takeover,positive
Auto Trader share price surges as company floats on LSE,positive
New Credit Suisse boss faces stiff challenge in Asia,negative
"UPDATE: EasyJet Passenger Numbers, Aer Lingus Traffic Up In February",positive
Is It Worth Investing In Tesco PLC And Prudential plc Now?,positive
UK WINNERS & LOSERS: Aviva And Friends Life Lead FTSE 100 Gainers,positive
Sainsbury's says to outperform rivals in tough market,positive
CompaniesKingfisher bid for Mr Bricolage runs into trouble,negative
UPDATE 3-Auto Trader shares leap in UK's biggest private equity-backed listing,positive
"London open: Taylor Wimpey and Ashtead drive markets higher, Barclays falls",positive
GSK and Novartis complete deals to reshape both drugmakers,positive
"Aviva, Friends Life top forecasts ahead of 5.6 billion pound merger",positive
Citigroup to Sell OneMain to Springleaf for $4.25 Billion,positive
"U.K. Stocks Resume Gains to Rally to Record; CRH, Tullow Climb",positive
British American Tobacco drops and sues PwC over pollution scandal,negative
UK's FTSE has worst day so far in 2015 as BG and Prudential fall,negative
"Kraft, Cadbury's and Britvic in Total Recall: how pulling a product affects profit",negative
How Kraft-Heinz Merger Came Together in Speedy 10 Weeks,positive
AstraZeneca Teams With Daiichi Sankyo To Sell Movantik In US,positive
RBI surprises Street; Sensex pares gains after hitting mount 30k,negative
Credit Suisse poaches Prudential's Thiam for Asian push,positive
Kingfisher takeover of Mr Bricolage could hit a brick wall,negative
"U.K. Stocks Little Changed Near Record as Barclays, Shell Fall",negative
Insurers: Admiral blows hot and cold but Aviva soars pre-Friends Life merger,positive
AstraZeneca And Daiichi Sankyo To Jointly Commercialise MOVANTIK In The US,positive
Legal & General arm buys 50 pct stake in MediaCityUK in Manchester,positive
Randgold profit hit by poor gold price but dividend still increases,negative
"CompaniesTravis Perkins lifts dividend, earnings rise 15%",positive
Market Report: Aviva tops the market as traders approve of its choice of Friends,positive
Insurer Old Mutual picks Standard Bank's Hemphill as new CEO,positive
"FDA panel backs safety updates for AstraZeneca, Takeda drugs",positive
CompaniesDiageo stays neutral on India boardroom turmoil,neutral
Germanwings disaster will not affect image of budget air travel - easyJet,negative
Shell's $70 Billion BG Deal Meets Shareholder Skepticism,negative
Shell offers 50 percent premium to buy BG for $70 billion,positive
WPP boosts sales despite cautious clients,positive
Shell to buy BG Group in $69.7 billion takeover,positive
LONDON MORNING BRIEFING: HSBC And Standard Chartered Shares Rise,positive
UPDATE 1-BP shareholders back more disclosure on climate change risks,positive
Shell challenges Exxon dominance with 47 billion-pound bid for BG,negative
Royal Dutch Shell to Buy BG Group for Nearly $70 Billion,positive
City spirits sink after Diageo comes up short with sales slide,negative
Diageo receives reports from United Spirits on financial irregularities involving ...,negative
Rolls-Royce Wins $9.2 Billion Order From Emirates Airline,positive
Tesco sales rise shows tentative recovery continues,positive
Diageo sales disappoint as currency and comparatives leave bitter taste,negative
AstraZeneca profit down as sales of stalwarts fade,negative
"Whitbread Profit Up As Sales Continue To Rise, Looking For New CEO",positive
Glencore blames rivals for creating metals glut,negative
Doubts grow over GlaxoSmithKline's $6 bln capital return plan,negative
easyJet leads Britain's FTSE lower as global bond rout resumes,negative
Imperial Tobacco Adds Quarterly Dividends After Profit Rose,positive
BG Group Still Happy With Shell's $70 Billion Offer,positive
SABMiller buys Meantime to quench thirst for craft beer,positive
Aviva shuts Friends Life head office in rapid integration move,negative
Retailers Kingfisher and Sports Direct rise in Britain's share index,positive
"GlaxoSmithKline targets growth across units, scraps ViiV IPO",positive
Tesco share price closes higher as two more directors leave grocer,positive
Tesco leads FTSE higher on Clubcard bid reports,positive
Eli Lilly & Co. (LLY) Has Broken Out To A New High On AstraZeneca Collaboration,positive
"RPT-Old Mutual Q1 gross sales beat forecasts, up 18 pct",positive
"UPDATE 3-BP settles oil spill-related claims with Halliburton, Transocean",negative
GlaxoSmithKline share price slips as FDA okays asthma therapy only for adults,negative
Glencore chief blames rivals' overproduction for share price fall,negative
"Philip Morris, BAT Sue Over Law Taking Branding Off Packs",negative
Hargreaves Lansdown share price falls as costs mount - although pensions ...,negative
"PRESS: Serco Set To Appoint Roy Gardner, Ex-Centrica, As Chairman - FT",positive
UPDATE 1-Cypress Semiconductor offers to buy Integrated Silicon Solution,positive
"UPDATE 1-Nomura, RBS must pay $806 mln in mortgage bond case-US judge",negative
MillerCoors Board Names Gavin Hattersley Interim CEO,neutral
"Britain's FTSE gains, Land Securities up after dividend hike",positive
"Britain's FTSE bounces back, Mondi and Barratt lead",positive
Old Mutual First-Quarter Sales Up 18% Buoyed by Emerging Markets,positive
Do it for me' trend underpins UK sales growth at Kingfisher,positive
"Aldi and Lidl expansion plans speed ahead as Tesco, Sainsbury's, Morrisons ...",positive
"Centrica extends gas deals with Gazprom, Statoil",positive
"Aberdeen AM posts H1 outflows, says conditions to remain challenging",negative
Severn Trent share price jumps as Canadian investor renews pursuit of utility,positive
New Morrisons duo get former boss's support to diffuse investor tension,positive
S&P downgrades Barclays and RBS on government bailout fears,negative
Irish housebuilder Cairn Homes plans London listing,positive
Arm slammed by handset sales outlook,negative
CompaniesLSE adds ex-SEC head Schapiro to board,positive
Sales boost for new Morrisons chief David Potts as Tesco turnaround stalls,negative
FTSE 100 flat; Standard Chartered leads risers,positive
CompaniesHoward Davies appointment as RBS director delayed,negative
Keith Skeoch to step up as David Nish quits as chief executive of Standard Life,negative
Dixons Carphone profit boost on strong sales,positive
"FTSE rallies off three-month low, boosted by StanChart, Sainsbury",positive
"Royal Mail, Johnson Matthey lead FTSE lower",negative
Sainsbury sales slip again as price pressures take a toll,negative
Sophos aims to raise $100m in London IPO,positive
UPDATE 3-Stifel to buy former Lehman brokerage from Barclays,positive
Borealis Infrastructure putting together new Severn Trent bid,positive
"FTSE falls to 3-month low on Greek debt concerns, easyJet skids",negative
Johnson Matthey share price slumps as company posts full-year results,negative
UPDATE: Barclays Expects Gain After Settling With Lehman Bros Trustee,positive
Petrofac books further £30m cost for Shetland gas terminal delays,negative
Petrofac share price rises despite £30m costs on North Sea project,positive
Whitbread boss Andy Harrison defends sales fall as 'just a blip',negative
Barclays share price subdued as bank faces fresh forex probe,negative
CompaniesActelion shares hit record on Shire takeover talk,positive
LSE gets Hong Kong regulatory nod to HK firms to become LSE members,positive
Diageo Shares Surge on Report of Possible Takeover by Lemann,positive
RBS chairman admits surprise at size of regulatory penalties,negative
RSA Insurance Hires Towergate's Egan as Chief Financial Officer,positive
Johnson Matthey raises prospect of investor payout,positive
InterContinental Hotels Denies Reports of Starwood Merger Talks,negative
REFILE-Hikma and Barclays help Britain's FTSE to climb higher,positive
FDA Approves AstraZeneca's Iressa As Lung Cancer Treatment,positive
AstraZeneca suffers setback after drug fails to treat eye cancer,negative
British American Tobacco first-half sales hurt by currency moves,negative
Zurich Insurance Considering Offer for UK Rival RSA Insurance,positive
Japan's Nikkei lands Financial Times in $1.3 billion deal,positive
"Ingenious, HSBC, UBS and Coutts sued by 'tax avoidance' clients",negative
UPDATE 1-AstraZeneca sells rare cancer drug to Sanofi for up to $300 mln,positive
Sainsbury sells unit to LloydsPharmacy,positive
BAE Systems's sales boosted by European Typhoon and currencies,positive
"Royal Mail 'breached competition law' over delivery service changes, Ofcom claims",negative
"Britain's FTSE steadies, supported by Dixons Carphone",positive
Glaxo's ViiV Healthcare Signs China Manufacturing Deal With Desano,positive
AstraZeneca sells Caprelsa rights to Sanofi unit,positive
UPDATE 5-Barclays Chairman McFarlane axes CEO to speed up strategic change,negative
Miners Meltdown as BHP to Rio Tinto Sink in Commodities Rout,negative
"FTSE led lower by M&S, GlaxoSmithKline",negative
GKN to buy Fokker Technologies for 706 mln euros,positive
Diageo Sells Ryder Cup Venue Gleneagles Hotel to Ennismore Group,positive
"UPDATE: CIB, Legal & General Sell Egyptian Life Joint Venture To AXA",positive
Chime Communications Set To Be Acquired By WPP And Providence,positive
"CompaniesNew Aggreko CEO to reshape business, strip costs",positive
AstraZeneca to Pay Inovio Up to $700 Million for Cancer Drug,positive
Rio Tinto CEO says iron ore market at equilibrium,neutral
US sanctions put Gazprom-Shell alliance plans in jeopardy,negative
Standard Chartered Not Raising Capital Yet As Dividend Cut,negative
"UPDATE 1-BHP Billiton's credit ratings fragile in FY16, agencies warn",negative
CRH adds CR Laurence to acquisitions tally for $1.3bn,positive
Novartis buys remaining rights to GSK treatment in deal up to $1 billion,positive
"AstraZeneca bags another cancer drug deal, this time with Inovio",positive
REFILE-Aviva Investors to move 34 bln euros in assets from AXA fund arm,negative
"L&G still paying price for dividend cut during crisis, chief says",negative
Buffett's Company Reports 37 Percent Drop in 2Q Earnings,negative
Travis Perkins Hikes Dividend 20% As Profit And Revenue Rise,positive
"Tesco, Asda sales fall as march of the discounters continues: Kantar",negative
Shire proposes $30 bln all-share tie-up with Baxalta,positive
Shire CEO steps up drive to get Baxalta board talking,positive
"Tesco, Asda sales fall as march of the discounters continues-Kantar",negative
Verizon and AT&T accused of hurting rivals,negative
"FTSE 100 falls as China devaluation hits Burberry, mining stocks",negative
"Nine banks including Barclays, Citi, agree to pay $2 billion to settle forex ...",negative
CompaniesCar insurer Hastings Group driving £180m IPO,positive
Glencore slumps 25 pct as debt fears grow,negative
Horizonte acquires neighbouring Glencore nickel property in Brazil,positive
UPDATE 1-Engineering firm Smiths Group confirms CEO appointment,positive
Industry NewsMorrisons unveils which stores will close as 900 jobs face the axe,negative
Glencore slumps 30 percent as debt fears grow,negative
Aberdeen Asset Management Gains Foothold In China,positive
ARM Holdings plc Partners With International Business Machines Corp. To Drive ...,positive
"FTSE 100 drops 2.5 pct on Glencore, metals price fears",negative
"After Barclays and Bank of America, Citigroup has blockchain in sight",positive
AB InBev approaches SABMiller to explore $250bn tie-up,positive
EU regulator backs approval for GSK injectable asthma drug,positive
Glencore fight back over debt fears lifts shares,positive
"News FeedFTSE 100 movers: Ashtead jumps on strong interims; Glencore, BP in ...",positive
Brewer AB InBev seeks $275 bln tie-up with SABMiller,positive
AB InBev looks to win over SABMiller investors,positive
UPDATE 1-EU regulator backs approval for GSK injectable asthma drug,positive
Copper market may get a 2003-style supply shock from Glencore closures,negative
TalkTalk hires BAE Systems to investigate cyber attack,negative
Renewed AB InBev Bid for SABMiller Ups Stake in Beer Battle,positive
CompaniesAB InBev signals it won't go hostile for SABMiller,positive
AstraZeneca diabetes drug combination faces delay after FDA rebuff,negative
Mylan Appoints Ranjan Ray Chaudhuri as Global Commercial Lead for Mylan's Over ...,neutral
SABMiller revenue hit by weaker EM currencies,negative
UPDATE 5-SABMiller rejects AB InBev's $104 bln takeover approach,positive
Market Report: Eight-day rally ends for FTSE 100 and Standard Chartered,positive
AB InBev offers SABMiller $3 billion breakup fee,positive
GSK joins China trade push as UK trumpets healthcare deals,positive
AB InBev ups offer for SABMiller as deadline looms,positive
Tesco PLC's Recovery Continues With A £250m Cash Infusion,positive
"METALS-Zinc surges 12 pct after Glencore cuts output, fuelling metals rally",positive
CompaniesUnilever sales lifted by ice cream in soft economy,positive
AB InBev's Latest Bid Said Unlikely to Win SABMiller's Approval,positive
Britain's FTSE forges ahead as Shire surges,positive
AB InBev attacks SABMiller bid rebuffal,negative
Anheuser-Busch InBev Increases Offer for Rival SABMiller,positive
Why I'd Buy ARM Holdings plc And BHP Billiton plc Today,positive
Barclays PLC & Lloyds Banking Group PLC Are The 2 Banks I'd Buy Today,positive
EasyJet Dismisses Lufthansa Low-Cost Plan in Contest for Germany,negative
"EXCLUSIVE-BP, China's CNPC to unveil oil alliance - sources",positive
SAB's Chairman Digs In With Board Divided on InBev Offer,positive
Kinder Morgan and BP Form Joint Venture Limited Liability Company to Purchase ...,positive
Supreme Court Upholds $236 Million Jury Award Against ExxonMobil,negative
Standard Chartered's Shares Plunge 7% After Fitch Downgrade,negative
WPP wins race for 'programmatic buying' agency Essence Digital,positive
BHP Billiton share price: Brazil to sue Samarco for £3.5bn,negative
G4S slides on balance sheet worries,negative
FDA approves AstraZeneca drug for advanced lung cancer,positive
HSBC appoints business leaders to board,positive
"HSBC shakes up board with two new business chiefs, three departures",negative
AstraZeneca wins FDA approval for key new lung cancer pill,positive
UPDATE 1-Lloyds to cut 945 jobs as part of 3-year restructuring plan,negative
Standard Chartered Shifts Emerging-Markets Strategy After Losses,negative
AstraZeneca's Lung Cancer Drug Tagrisso Gets FDA Approval,positive
Severn Trent share price rises as first half profit inches up as customer ...,positive
Glencore sees Tripoli-based NOC as sole legal seller of Libyan oil,positive
Lloyds to cut 945 jobs as part of three-year restructuring strategy,negative
AstraZeneca to Buy ZS Pharma for $2.7 Billion,positive
"Ackman, in email, says supports Valeant CEO Pearson",positive
AstraZeneca sells US drug rights to Perrigo for $380 mln,positive
"UPDATE 1-AstraZeneca buys ZS Pharma for $2.7 billion, pips Actelion",positive
CORRECTED-Shire to buy Dyax for about $5.9 bln,positive
Barclays poised to replace Sir Mike Rake as he heads for exit,positive
AstraZeneca Acquires ZS Pharma in $2.7 Billion Deal,positive
AstraZeneca shares climb 3% as drug maker ups profits forecasts,positive
Peroni and Grolsch put up for sale as AB InBev plans acquisition of SABMiller,positive
easyJet expects resilient demand to withstand security fears,positive
Compass Group says positive for year ahead,positive
US dollar wipes out sales gains for SABMiller,negative
"UPDATE 1-SABMiller 2nd-quarter underlying sales rise, forex impacts margins",positive
UPDATE 2-Pricey beers lift SABMiller's quarterly underlying sales,positive
Valeant CEO Pledges to Heed Critics After `Painful' Experience,negative
"Are Aviva plc, Direct Line Insurance Group PLC And Admiral Group plc Set To Soar?",positive
StanChart and RBS struggle in Bank of England stress tests,negative
Barclays sells benchmark indices unit to Bloomberg,positive
"Sainsbury's, Asda, Tesco and Morrisons will all cut petrol prices as oil falls ...",negative
"EU drops Shell, BP, Statoil from ethanol benchmark investigation",positive
AstraZeneca Explores Potential Deal With Acerta for Cancer Drug,positive
Shell and BG Shareholders to Vote on Deal at End of January,neutral
AstraZeneca chases Acerta to secure next cancer drug winner,positive
CompaniesTesco off to a bad start over Xmas – Kantar,negative
"DBS, Julius Baer emerge as potential bidders for Barclays Asia wealth unit ...",positive
Why AstraZeneca plc & Dixons Carphone PLC Are Red-Hot Growth Stars!,positive
BBCN Bancorp to buy Wilshire Bancorp in $1 bln deal,positive
ITV share price jumps on report of Comcast's NBCUniversal bidding to takeover ...,positive
Glencore Studies Possible IPO for Agricultural Trading Business,positive
Can Christmas Save Sainsbury's plc And Tesco plc?,negative
UPDATE 1-AstraZeneca boosts respiratory unit with $575 mln Takeda deal,positive
Bilfinger Industrial Services win £100m BP contract extension,positive
"Standard Chartered, RBS Escape Capital Raising in Stress Test",positive
AstraZeneca weighing up Acerta bid to secure blood cancer drug,positive
2 Turnaround Buys For 2016? BHP Billiton plc And Home Retail Group Plc,positive
L&G completes UK's largest medically underwritten bulk pension risk deal,positive
Drugmaker Shire to buy Baxalta for $32 billion after 6-month pursuit,positive
Kingfisher share price slides on cost to implement new strategy,negative
Shire says internal synergy goals from Baxalta deal higher,positive
"European shares plunge, roiled by BHP and oil; hopes turn to ECB",negative
Morrisons and Debenhams surprise City with Christmas bounce back,positive
"Britain's FTSE falls back with Ashtead, commodities under pressure",negative
Tesco shares jump 6% after Christmas sales beat expectations,positive
"CEOs of BPM, UBI meet Italy econ minister as M&A talk heats up",positive
CompaniesHome Retail trims gains but is considered 'in play',positive
Philippines' San Miguel says to partner with Kirin if it bids for SABMiller's ...,positive
Investors Remain Skeptical About Shell-BG Deal,negative
MarketsShire up 2.5% and Baxalta up 6% on $32bn deal,positive
Shire share price under pressure after $32bn Baxalta deal,negative
Valeant Names Interim Leader as CEO Remains Hospitalized,neutral
Valeant Said to Name New CEO With Pearson Still Hospitalized,positive
Shares in BAE Systems hit 10-month high on rating upgrade,positive
Japan's Asahi to submit bid next week for SABMiller's Grolsch and Peroni - Yomiuri,positive
CompaniesDixons Carphone to close 134 UK stores as sales jump,positive
"Broker tips: RBS, Croda, Sage",positive
Shell share price: Standard Life announce position against BG acquisition,negative
Tesco share price down as grocer faces SFO investigation outcome,negative
"Britain's FTSE outperforms Europe, Royal Mail and Tesco rise",positive
Greene King's third quarter sales boosted by festive season,positive
InterContinental Hotels Group share price climbs on $1.5bn special dividend,positive
Amazon to attack UK grocery market with Morrisons deal,positive
AstraZeneca share price: Acerta deal pays off with orphan drug status,positive
"BHP Billiton posts big loss, slashes dividend",negative
Merged LSE and Deutsche Börse would be led by Germany's Kengeter,positive
"Should You Buy Jumbo Yielders British American Tobacco plc, Centrica PLC & John Wood Group PLC?",positive
Is Trouble Brewing At Legal & General Group Plc And Aviva plc?,negative
BHP Billiton drags FTSE lower after slashing dividend,negative
"BHP Billiton slashes dividend, posts $5.67 billion net loss",negative
CompaniesMeggitt profits hit by weak energy and military markets,negative
Royal Mail share price edges lower as group raises stamp price,negative
GlaxoSmithKline starts hunt for successor to CEO Witty,neutral
"Rio Tinto swings to loss, drops dividend policy",negative
France raises concerns over proposed LSE-Deutsche Boerse deal,negative
MarketsBP promotes upstream boss to deputy CEO,positive
Legal & General share price: Finance chief to step down,negative
Barclays poaches new chief operating officer Paul Compton from JP Morgan Chase,negative
Arm profits and sales up as shift away from mobile gains pace,positive
Barclays appoints JPMorgan's Paul Compton as new COO,positive
"FastJet slams EasyJet founder Stelios for going public, is 'taking legal advice' over letter about contractual ...",negative
NYSE owner ICE considers offer for LSE,positive
News FeedFTSE 100 movers: LSE surges as ICE says mulling offer; Ashtead and Barclays tank,positive
Balfour Beatty plc Set To Reinstate Dividend (And Rival National Grid plc And Centrica PLC Once More?),positive
Intertek swings to £347 mln loss on oil's slump,negative
Sanofi poaches AstraZeneca scientist as new research head,positive
Tesco breaks its downward slide by cutting sales decline in half,positive
"News FeedSchroders books solid earnings growth, several board changes",positive
Intertek Group announces strategic update outlining its plan,positive
London Stock Exchange seals £22 billion merger with Germany's Deutsche Börse,positive
NYSE owner ICE may gatecrash Deutsche Boerse-LSE merger,negative
AB InBev to Sell SABMiller Stake in China's Snow Beer,negative
LSE-Deutsche Boerse merger would signal end to exchange mega-deals,positive
RBS Pays $1.7 Billion to Scrap U.K. Treasury's Dividend Rights,positive
Industry NewsWolseley confident in reslilience amid mixed markets,positive
Tesco criticised for 'disgraceful' advert showing domestic worker being slapped,negative
FTSE edges up as investors cheer Kingfisher results,positive
Barclays Bonds Rise as Lender Cuts Dividends to Shore Up Capital,positive
Britain's FTSE gets lift from Prudential results,positive
Amazon's grocery deal with Morrisons is only the beginning,positive
