ICE Said to Start Lining Up Financing for LSE Bidding War,positive
"BP, Statoil, to Withdraw Staff From Algeria Following Rocket Attack",negative
Merkel's Government Said to Support Deutsche Boerse-LSE Merger,positive
Aviva weighs cash handout after beating profit forecast,positive
"WPP, World's Largest Ad Agency, Reports Strong 2015 Growth",positive
"Saudi Aramco, Shell plan to break up Motiva, divide up assets",negative
AB InBev to sell more SAB assets as seeks EU deal approval,negative
Tesco's Sales Pickup Isn't Enough,negative
Spain's CaixaBank Expects To Close Deal For Banco BPI,positive
ITV share price: Group mulls takeover of Canada's Entertainment One,positive
Entertainment One dispels ITV takeover rumours,positive
GE to Sell Majority Stake in Bank BPH's Core Bank to Alior Bank,positive
Tata Steel working with StanChart for UK unit sale - source,positive
Crown Castle buys Tower Development Corp for $461 million,positive
Tesco sells half of stake in ecommerce site Lazada to Alibaba for £90m,negative
"CaixaBank, dos Santos Agree on Plan for BPI Angola Exposure",positive
"BPI Says Caixabank, Isabel dos Santos Reach Agreement Over Angola Exposure",positive
Spain's Caixabank launches new takeover bid for Banco BPI,positive
"Despite sales growth, UK's Tesco cautions recovery to be bumpy",negative
ITV to pursue takeover of Canada's Entertainment One: Bloomberg,positive
Shire Sees Baxalta Deal Closing as Expected After New Rules,positive
"OCBC to Buy Barclay's Wealth Management Unit in Singapore, Hong Kong",positive
Tesco share price steady as analysts weigh in on results,positive
Lloyds Banking Group's share price lifts amid reports bank is poised to axe hundreds of UK jobs,positive
Should You Follow Berkshire Hathaway Into Apple Stock?,neutral
Morrisons book second consecutive quarter of sales growth,positive
Royal Mail gets mixed bag from Ofcom postal regulation report,negative
UPDATE 3-Ex-Barclays director accused by US of illegal tips to plumber,negative
"EU regulators clear $100 billion-plus AB InBev, SABMiller deal",positive
Retail giant Kingfisher reports 'solid' start to the year,positive
"Berkshire discloses unit's ties to Iran, opens probe",negative
Berkshire Hathaway names Kara Raiguel to lead General Re unit,positive
"European stocks hover near 3-week low, Dialog and BHP slump",negative
Hargreaves Lansdown bucks weak markets to see assets rise 2.6 percent,positive
Australia clears AB Inbev's $100 billion SABMiller buyout plan,positive
Goodwin not to face Scottish prosecution over RBS,positive
Royal Mail turnaround proving expensive in tough UK market,negative
Whitbread buys 49% stake in Pure food chain,positive
"Irish Said Chasing Standard Chartered, RBS as Brexit Vote Nears",positive
Royal Mail share price rallies amid positive broker comments,positive
InterContinental Hotels first-quarter global room revenue lags estimates,negative
Aspen to Buy Anaesthetics From AstraZeneca for $520 Million,positive
London Stock Exchange – Deutsche Boerse merger under threat from Brexit,negative
Sainsbury CFO Rogers to Replace Home Retail CEO Walden,neutral
BP joins forces with Det Norske in Norway,positive
BRIEF-Legal & General's retirement business books 4 billion stg H1 sales,positive
Johnson Matthey revs up on clean air drive,positive
"Goldman Sachs, Barclays, HSBC downplay Brexit threat",neutral
Asahi could be about to snap up more of SABMiller's beers ahead of AB InBev sale,positive
LSE-Deutsche Börse dealmakers wrong to ignore Brexit risk,negative
Tesco sales recover as focus returns to core business,positive
Johnson Matthey profit falls but dividend rises,neutral
"Are ARM Holdings plc, Domino's Pizza Group plc and ASOS plc 3 must-have growth stocks?",neutral
Priceline's stock jumps to new high for the year after Barclays upgrade,positive
"Tesco set to sell Kipa, Giraffe businesses - Sky News",negative
The Coca-Cola Company and Coca-Cola FEMSA to Acquire AdeS Soy-Based Beverage Business From Unilever,positive
HSBC Says Unit to Book $585 Million Charge on Settlement,negative
"Hammerson, JV Partner secure ownership of Ireland's Dundrum - Quick Facts",positive
Aviva promises higher dividends to boost flagging share price,positive
CompaniesFresnillo shares jump 8% as silver price breaks $21,positive
"Should you buy Associated British Foods plc, Great Portland Estates plc and Dunelm Group plc following today's news?",positive
Berkshire seeks to boost its Wells Fargo stake above 10 percent,positive
Tesco share price tumbles after negative broker note,negative
London Stock Exchange Shareholders Approve Merger With Deutsche Börse,positive
UPDATE 1-Berkshire applies to boost Wells Fargo stake above 10 pct,positive
Berkshire applies to boost Wells Fargo stake above 10 percent,positive
"Aviva, M&G suspend property funds as investors panic",negative
"UK housing market steadies after Brexit dip, Persimmon says",positive
BRIEF-Aviva aims to increase dividend pay-out ratio to 50 pct in 2017,positive
Builder Persimmon hails 6% rise in house sales,positive
EasyJet attracts more passengers in June but still lags Ryanair,positive
